{
  "app_name": "StockFlow",
  "app_icon": {
    "source": ".consort/design/assets/warehouse.png",
    "install_to": "client/public/warehouse.png"
  },
  "typography": {
    "font_family": "'DM Sans', system-ui, -apple-system, 'Segoe UI', Roboto, sans-serif",
    "font_mono": "'DM Mono', ui-monospace, SFMono-Regular, Menlo, monospace",
    "scale": {
      "text-xs": "10px",
      "text-sm": "13px",
      "text-base": "15px",
      "text-md": "16px",
      "text-lg": "20px",
      "text-xl": "24px",
      "text-xxl": "29px"
    },
    "line_heights": {
      "body": "1.5",
      "heading": "1.25",
      "tight": "1.1"
    },
    "font_weights": {
      "regular": "400",
      "medium": "500",
      "semibold": "600",
      "bold": "700"
    }
  },
  "colors": {
    "brand": {
      "brand": "#FF3621",
      "brand-hover": "#EB1600",
      "brand-light": "rgba(255,54,33,0.08)",
      "navy-900": "#1B3139",
      "navy-700": "#1B5162",
      "navy-500": "#618794",
      "navy-400": "#90A5B1",
      "navy-300": "#C4CCD6",
      "navy-200": "#E5EAF1",
      "navy-100": "#EDF2F8"
    },
    "semantic": {
      "success": "#2E844A",
      "success-light": "rgba(46,132,74,0.10)",
      "warning": "#FFAB00",
      "warning-light": "rgba(255,171,0,0.12)",
      "info": "#0176D3",
      "info-light": "rgba(1,118,211,0.10)",
      "error": "#FF3621",
      "error-light": "rgba(255,54,33,0.08)"
    },
    "surface": {
      "card": "#FFFFFF",
      "page": "#F9F7F4",
      "cool": "#F0F2F5"
    },
    "text": {
      "text": "#1B3139",
      "text-secondary": "#1B5162",
      "text-tertiary": "#618794",
      "text-disabled": "#90A5B1",
      "text-inverse": "#FFFFFF"
    }
  },
  "spacing": {
    "space-0": "0px",
    "space-1": "4px",
    "space-2": "8px",
    "space-3": "12px",
    "space-4": "16px",
    "space-5": "20px",
    "space-6": "24px",
    "space-8": "32px",
    "space-10": "40px",
    "space-12": "48px",
    "content-max-width": "960px",
    "narrow-max-width": "560px",
    "navbar-height": "64px",
    "tap-target": "44px",
    "border-width": "1px",
    "border-accent": "2px",
    "focus-ring": "2px",
    "lift": "-2px",
    "icon-sm": "16px",
    "icon-md": "24px",
    "icon-brand": "32px",
    "icon-empty": "48px"
  },
  "radius": {
    "radius-none": "0px",
    "radius-sm": "4px",
    "radius-md": "8px",
    "radius-lg": "12px",
    "radius-xl": "15px",
    "radius-pill": "999px"
  },
  "shadows": {
    "shadow-sm": "0 2px 8px rgba(27,49,57,0.06)",
    "shadow-md": "0 4px 16px rgba(27,49,57,0.08)",
    "shadow-lg": "0 2px 4px rgba(27,49,57,0.04), 0 8px 24px rgba(27,49,57,0.10), 0 16px 48px rgba(27,49,57,0.08)",
    "shadow-navbar": "0 2px 12px rgba(27,49,57,0.24)"
  },
  "breakpoints": {
    "mobile": "480px",
    "tablet": "768px",
    "desktop": "1024px"
  },
  "motion": {
    "transition-fast": "0.15s ease",
    "transition-base": "0.2s ease",
    "toast-dismiss": "3s"
  },
  "components": {
    "navbar": {
      "class": "navbar",
      "notes": "navy-900 bar, 64px, 2px brand-red bottom border; navbar__brand (warehouse icon + 'StockFlow') left, navbar__links right, active link brand red via navbar__link--active / aria-current=page"
    },
    "page": {
      "class": "page",
      "variants": "page--narrow (560px, detail + forms)",
      "notes": "warm-oat bg, centered 960px column, page__header with page__title and app icon"
    },
    "card": {
      "class": "card",
      "notes": "white, --radius-lg, --shadow-sm, hover lift (shadow-md, translateY -2px); holds stock table and detail panels"
    },
    "button": {
      "class": "btn",
      "variants": "btn--primary (solid brand red, 0 radius), btn--secondary (outlined navy-200), btn--ghost, btn--danger, btn--danger-outline, btn--sm; min 44px tap target; disabled+spinner (aria-busy) in flight"
    },
    "form_input": {
      "class": "field",
      "notes": "field__label persistent (never placeholder-only), field__input info-color focus ring, field--error (error border + error-light fill) with field__error naming the field inline"
    },
    "alert": {
      "class": "alert",
      "notes": "inline alert for page-load failure and validation only; role=alert"
    },
    "stock_table": {
      "class": "stock-table",
      "notes": "cool uppercase header; .num cells right-aligned, DM Mono tabular-nums; row-flash on in-place update"
    },
    "status_pill": {
      "class": "pill",
      "variants": "pill--in-stock, pill--low, pill--out, pill--on-order, pill--quarantined, pill--not-tracked; meaning carried by text label + color + border style, never color alone"
    },
    "new_to_verify_pill": {
      "class": "pill pill--new-to-verify",
      "notes": "F6: info-blue pill reading 'New - verify' on the Batch and Serial column headers/cells"
    },
    "to_be_retired_pill": {
      "class": "pill pill--to-be-retired",
      "notes": "F6: dashed neutral pill reading 'To be retired' on the combined tracking code column; absent after F10"
    },
    "stage_label": {
      "class": "stage-label",
      "variants": "stage-label--transition",
      "notes": "F6/F10: small uppercase chip beside the home page__title, text 'Today' or 'Transition - to verify'; text carries the meaning"
    },
    "migration_overlay": {
      "class": "migration-overlay",
      "notes": "F6: fixed full-screen navy scrim with spinner (migration-overlay__spinner) and step text, role=status aria-live=polite; shown while a migration step runs, hidden when it finishes; no layout shift"
    },
    "empty_state": {
      "class": "empty-state",
      "notes": "icon + teaching heading + copy + CTA; never a blank region; 'No stock at this location - receive an inbound shipment'"
    },
    "scan_zone": {
      "class": "scan-zone",
      "variants": "scan-zone--success, scan-zone--error",
      "notes": "green flash on success, red flash on failure paired with persistent error toast"
    },
    "toast": {
      "class": "toast",
      "variants": "toast--success (auto-dismiss ~3s), toast--error (persists)",
      "notes": "inside fixed top-right toast-region; role=status / role=alert; no layout shift"
    },
    "feedback_matrix": {
      "class": "toast",
      "notes": "Feedback matrix (no silent failures): form_submit: success=navigate to confirmation view | failure=inline alert + field-named error; barcode_scan: success=row updates in place + green scan-zone flash | failure=red scan-zone flash + persistent error toast; inline_mutation: success=auto-dismiss success toast (~3s) | failure=persistent error toast; delete_remove: success=success toast + optimistic update | failure=persistent toast + local revert; page_load: success=n/a | failure=inline alert replaces content area; button_action: success=disabled + spinner while in flight | failure=re-enabled + error shown"
    },
    "browse_provenance": {
      "notes": "browsed:https://www.databricks.com (raw CSS: #1b3139, #f9f7f4, #ff3621, #eeede9, DM Sans) -> brand+color; browsed:https://brand.databricks.com (raw markup: DM Sans, #1B3139, #F9F7F4) -> typography+palette; browsed:https://www.cin7.com (marketing page: card-grouped feature areas, horizontal top nav; no dashboard UI visible) -> layout cue only; browse-gap:https://www.linnworks.com (marketing copy only, no product UI); browse-gap:https://www.fishbowlinventory.com (not fetched); browse-gap: no reference showed a real stock table, so table density comes from the brief"
    }
  }
}